{
  "schema_format": "1.0",
  "name": "Test Schema",
  "version": "1.0.0",
  "tables": {
    "users": {
      "columns": {
        "id": {
          "type": "identifier",
          "auto_increment": true
        },
        "name": {
          "type": "text",
          "max_length": 100,
          "required": true
        }
      },
      "primary_key": ["id"]
    }
  }
}
